{
  "$schema": "http://json-schema.org/draft-04/schema#",
  "id": "http://justice.gov.uk/core/courts/materialDetails.json",
  "description": "The context for material",
  "type": "object",
  "properties": {
    "userId": {
      "description": "The requesting user",
      "$ref": "http://justice.gov.uk/domain/core/common/definitions.json#/definitions/uuid"
    },
    "fileId": {
      "description": "File ref",
      "$ref": "http://justice.gov.uk/domain/core/common/definitions.json#/definitions/uuid"
    },
    "hearingId": {
      "description": "The hearingId",
      "$ref": "http://justice.gov.uk/domain/core/common/definitions.json#/definitions/uuid"
    },
    "caseId": {
      "description": "The caseId",
      "$ref": "http://justice.gov.uk/domain/core/common/definitions.json#/definitions/uuid"
    },
    "applicationId": {
      "description": "The ApplicationId",
      "$ref": "http://justice.gov.uk/domain/core/common/definitions.json#/definitions/uuid"
    },
    "materialId": {
      "description": "The address4",
      "$ref": "http://justice.gov.uk/domain/core/common/definitions.json#/definitions/uuid"
    },
    "firstClassLetter": {
      "type": "boolean"
    },
    "secondClassLetter": {
      "type": "boolean"
    },
    "emailNotifications": {
      "description": "The email notifications required to be sent for this document",
      "type": "array",
      "minItems": 1,
      "items": {
        "$ref": "http://justice.gov.uk/core/courts/notification/email-channel.json"
      }
    },
    "payloadFileUri": {
      "type": "string",
      "format": "uri"
    },
    "destinationFileUri": {
      "type": "string",
      "format": "uri"
    }
  },
  "required": [
    "userId",
    "hearingId",
    "materialId"
  ],
  "oneOf": [
    {
      "required": [
        "fileId"
      ]
    },
    {
      "required": [
        "payloadFileUri",
        "destinationFileUri"
      ]
    }
  ],
  "additionalProperties": false
}