{
  "userId": "42c6c143-c994-4913-9e79-37b418982636",
  "fileId": "42c6c143-c994-4913-9e79-37b418982636",
  "hearingId": "0dd6f629-8a36-4c44-9588-14e7877fa11b",
  "materialId": "0c739c58-9633-4711-82aa-a48ae3aa8f84",
  "caseId": "b4b55110-1d50-11e8-accf-0ed5f89f718b",
  "applicationId": "b4b55110-1d50-11e8-accf-0ed5f89f718b"
}